{
 "version": 2,
 "layer": "common",
 "updated": "2026-10-01",
 "note": "공통 절차(서무비서 기본 탑재). 근거 조문은 regulations/ 의 현행 내규 기준. [[erp]]·[[portal]]·[[accounting]]은 기관 설정의 명칭으로 바뀝니다. verified 는 근거 규정의 확인 당시 개정 정보(scripts/stamp_procedures.py).",
 "procedures": [
  {
   "id": "domestic-trip",
   "icon": "🚆",
   "category": "출장",
   "title": "국내출장 — 신청부터 여비 정산까지",
   "summary": "출장 전 근무상황 등록·결재, 복귀 후 출장결과보고와 운임·숙박비 정산(마친 날 다음 날부터 14일 이내)까지.",
   "triggers": [
    "국내출장",
    "출장",
    "출장정산",
    "여비",
    "여비정산",
    "정산",
    "복명",
    "복명서",
    "출장결과",
    "숙박비",
    "운임",
    "일비",
    "출장 다녀",
    "출장다녀",
    "출장 가",
    "출장가",
    "KTX",
    "기차표",
    "출장비"
   ],
   "dates": [
    {
     "k": "start",
     "l": "출발일"
    },
    {
     "k": "end",
     "l": "출장 마친 날"
    }
   ],
   "approval": "국내출장 및 복명 — 「위임전결규칙」 별표 '5. 복무관리 가.'의 전결권자(직급별로 다름)",
   "steps": [
    {
     "t": "출장 계획 확정 후 근무상황(출장)을 등록하고 결재를 받습니다.",
     "k": "s1",
     "when": "출장 전",
     "docs": [
      "근무상황(출장) 등록 — [[erp]]"
     ],
     "basis": [
      {
       "reg": "복무규정",
       "art": "8"
      },
      {
       "reg": "위임전결규칙",
       "art": "6"
      }
     ]
    },
    {
     "t": "공용차량을 이용하면 [[erp]] 자원예약(배차)으로 배차 승인을 받습니다.",
     "k": "s2",
     "when": "사용예정일 1일 전까지",
     "deadline": {
      "ref": "start",
      "days": -1
     },
     "optional": true,
     "docs": [
      "배차신청([[erp]]) — 시스템 불가 시 배차신청서(별지 제3호)"
     ],
     "basis": [
      {
       "reg": "공용차량관리규칙",
       "art": "16"
      }
     ]
    },
    {
     "t": "운임·숙박비는 법인카드로 결제하는 것이 원칙입니다(불가 사유가 있으면 사유를 남겨 두세요).",
     "k": "s3",
     "when": "출장 중",
     "basis": [
      {
       "reg": "여비규정",
       "art": "8"
      }
     ]
    },
    {
     "t": "출장기간을 바꿔야 하면 지체 없이 부서장에게 보고하고 지시를 받습니다.",
     "k": "s4",
     "when": "변경 사유 발생 시",
     "optional": true,
     "basis": [
      {
       "reg": "복무규정",
       "art": "8"
      }
     ]
    },
    {
     "t": "복귀 후 출장결과보고서(복명서)를 부서장에게 제출합니다. 경미한 사항은 구두 보고도 가능합니다.",
     "k": "s5",
     "when": "복귀 후",
     "deadline": {
      "ref": "end",
      "days": 0,
      "label": "복귀 직후"
     },
     "docs": [
      "출장결과보고서(복명서)"
     ],
     "draft": "trip-report",
     "basis": [
      {
       "reg": "복무규정",
       "art": "8"
      }
     ]
    },
    {
     "t": "운임·숙박비 세부 사용내역 증거서류를 갖춰 정산을 신청합니다.",
     "k": "s6",
     "when": "마친 날 다음 날부터 14일 이내",
     "deadline": {
      "ref": "end",
      "days": 14
     },
     "docs": [
      "운임 영수증·승차권",
      "숙박 영수증",
      "법인카드 매출전표",
      "(개인차량) 통행료·주차비 영수증"
     ],
     "draft": "travel-settle",
     "basis": [
      {
       "reg": "여비규정",
       "art": "8"
      },
      {
       "reg": "여비업무 처리지침",
       "q": "여비의 정산"
      }
     ]
    },
    {
     "t": "숙박비 상한을 넘겨 추가 지급(상한액의 10분의 3 이내)을 받으려면 세부 내역 증거자료를 붙여 별도로 신청합니다.",
     "k": "s7",
     "when": "마친 날 다음 날부터 1주일 이내",
     "deadline": {
      "ref": "end",
      "days": 7
     },
     "optional": true,
     "basis": [
      {
       "reg": "여비규정",
       "art": "15"
      }
     ]
    },
    {
     "t": "서무담당이 정산 내역을 확인하고 여비정산시스템에서 계산해 지급결의합니다.",
     "k": "s8",
     "when": "정산 신청 후",
     "docs": [
      "여비 지출결의([[erp]])"
     ],
     "basis": [
      {
       "reg": "여비업무 처리지침",
       "q": "서무담당자"
      }
     ]
    }
   ],
   "forms": [],
   "tips": [
    "근무지내 출장(같은 시·군이거나 여행거리 40km 미만): 4시간 이상 2만원, 4시간 미만 1만원. 공용차량을 쓰면 1만원 감액(「여비규정」 제17조).",
    "공용차량을 이용하면 일비는 2분의 1만 지급합니다(「여비규정」 제15조제3항).",
    "국내 숙박비 상한(제2호): 서울 10만원, 광역시·제주 8만원, 그 밖 7만원(「여비업무 처리지침」).",
    "개인차량 통행료·주차비는 실비 정산이 원칙이라 영수증을 잃어버리면 지급되지 않습니다.",
    "법인카드로 결제했다면 카드대금 결제일 전에 정산 신청이 끝나야 합니다."
   ],
   "pitfalls": [
    {
     "t": "정산 신청이 출장을 마친 날 다음 날부터 14일 이내인가요?",
     "check": {"kind": "deadline", "ref": "end", "days": 14},
     "basis": [
      {
       "reg": "여비규정",
       "art": "8"
      }
     ]
    },
    {
     "t": "운임·숙박비 세부 사용내역을 확인할 증거서류(승차권·숙박 영수증·매출전표)를 모두 붙였나요?",
     "check": {"kind": "attach"},
     "basis": [
      {
       "reg": "여비규정",
       "art": "8"
      }
     ]
    },
    {
     "t": "법인카드로 결제하지 못했다면 그 사유를 적었나요?",
     "basis": [
      {
       "reg": "여비규정",
       "art": "8"
      }
     ]
    },
    {
     "t": "2일 이상 근무지외 출장이면 날짜별 세부내역을 회계 담당이 확인할 수 있게 정리했나요?",
     "basis": [
      {
       "reg": "여비업무 처리지침",
       "q": "2일 이상 근무지외 출장"
      }
     ]
    },
    {
     "t": "공용차량을 이용했다면 일비 2분의 1, 근무지내 여비 1만원 감액을 반영했나요?",
     "basis": [
      {
       "reg": "여비규정",
       "art": "15"
      },
      {
       "reg": "여비규정",
       "art": "17"
      }
     ]
    },
    {
     "t": "숙박비 상한 초과분 추가 지급은 마친 날 다음 날부터 1주일 안에 따로 신청했나요?",
     "basis": [
      {
       "reg": "여비규정",
       "art": "15"
      }
     ]
    },
    {
     "t": "출장결과보고(복명)를 마쳤나요?",
     "basis": [
      {
       "reg": "복무규정",
       "art": "8"
      }
     ]
    }
   ],
   "verified": {
    "공용차량관리규칙": "2023년도 7월 전부개정",
    "복무규정": "2025년도 10월 일부개정",
    "여비규정": "2023년도 5월 일부개정",
    "여비업무 처리지침": "2026년도 6월 개정",
    "위임전결규칙": "2026년도 6월 11일 개정"
   }
  },
  {
   "id": "overseas-trip",
   "icon": "✈️",
   "category": "출장",
   "title": "공무국외출장 — 심사·실시계획·귀국보고",
   "summary": "기본계획서 제출 → 심사위원회 심사·허가 → 출국 10일 전 실시계획서·서약서 → 귀국 후 30일 이내 귀국보고서, 10일 이내 마일리지 신고.",
   "triggers": [
    "국외출장",
    "해외출장",
    "해외",
    "국외",
    "출국",
    "귀국",
    "귀국보고",
    "귀국보고서",
    "마일리지",
    "비자",
    "여권",
    "심사위원회",
    "실시계획서"
   ],
   "dates": [
    {
     "k": "start",
     "l": "출국일"
    },
    {
     "k": "end",
     "l": "귀국일"
    }
   ],
   "approval": "국외출장 및 복명(귀국보고) — 「위임전결규칙」 별표 '5. 복무관리 나.'(직급별 전결권자), 허가는 원장",
   "steps": [
    {
     "t": "소속 본부장이 국외출장 기본계획서를 작성해 총괄부서에 제출합니다.",
     "k": "s1",
     "when": "심사 전",
     "docs": [
      "국외출장 기본계획서(별지 제1호)"
     ],
     "form": {
      "reg": "공무국외출장 관리규칙",
      "label": "별지 제1호 서식"
     },
     "basis": [
      {
       "reg": "공무국외출장 관리규칙",
       "art": "7"
      }
     ]
    },
    {
     "t": "국외출장 심사위원회가 여행의 적절성을 심사합니다(정기회의는 반기별, 시급하면 임시·서면 회의).",
     "k": "s2",
     "when": "허가 전",
     "basis": [
      {
       "reg": "공무국외출장 관리규칙",
       "art": "5"
      }
     ]
    },
    {
     "t": "원장의 허가를 받고, 위임전결규칙에 따른 국외출장 복무 결재를 받습니다.",
     "k": "s3",
     "when": "허가 후",
     "basis": [
      {
       "reg": "공무국외출장 관리규칙",
       "art": "4"
      }
     ]
    },
    {
     "t": "출장자·출장금액 등을 적은 국외출장 실시계획서와 서약서를 총괄부서에 내고 점검을 받습니다.",
     "k": "s4",
     "when": "출국일 10일 전까지",
     "deadline": {
      "ref": "start",
      "days": -10
     },
     "docs": [
      "국외출장 실시계획서(별지 제2호)",
      "국외출장 서약서(별지 제6호)"
     ],
     "form": {
      "reg": "공무국외출장 관리규칙",
      "label": "별지 제2호 서식"
     },
     "basis": [
      {
       "reg": "공무국외출장 관리규칙",
       "art": "9"
      }
     ]
    },
    {
     "t": "준비금(비자 발급비·예방접종비·여행자보험·풍토병 예방약 등)은 실비로 정산합니다. 검역관리지역 예방접종은 공가로 처리할 수 있습니다.",
     "k": "s5",
     "when": "출국 전",
     "optional": true,
     "basis": [
      {
       "reg": "여비규정",
       "art": "21"
      },
      {
       "reg": "복무규정",
       "art": "32"
      }
     ]
    },
    {
     "t": "운임·숙박비 증거서류를 갖춰 정산을 신청합니다.",
     "k": "s6",
     "when": "귀국 다음 날부터 14일 이내",
     "deadline": {
      "ref": "end",
      "days": 14
     },
     "docs": [
      "항공권 영수증·탑승권",
      "숙박 영수증",
      "법인카드 매출전표"
     ],
     "draft": "travel-settle",
     "basis": [
      {
       "reg": "여비규정",
       "art": "8"
      }
     ]
    },
    {
     "t": "항공마일리지 적립 여부를 확인하고 항공마일리지 신고서를 제출합니다.",
     "k": "s7",
     "when": "귀국 후 10일 이내",
     "deadline": {
      "ref": "end",
      "days": 10
     },
     "docs": [
      "항공마일리지 신고서"
     ],
     "basis": [
      {
       "reg": "공무국외출장 관리규칙",
       "art": "13"
      }
     ]
    },
    {
     "t": "국외출장 귀국보고서를 작성해 부서장 결재 후 총괄부서에 내고 [[portal]]에 게시합니다. 일정 진행을 증명하는 검증자료를 함께 냅니다.",
     "k": "s8",
     "when": "귀국 후 30일 이내",
     "deadline": {
      "ref": "end",
      "days": 30
     },
     "docs": [
      "국외출장 귀국보고서(별지 제5호)",
      "현지 일정 검증자료(사진·회의록 등)"
     ],
     "form": {
      "reg": "공무국외출장 관리규칙",
      "label": "별지 제5호 서식"
     },
     "draft": "overseas-report",
     "basis": [
      {
       "reg": "공무국외출장 관리규칙",
       "art": "13"
      }
     ]
    }
   ],
   "forms": [
    {
     "reg": "공무국외출장 관리규칙",
     "label": "별지 제1호 서식",
     "title": "국외출장 기본계획서"
    },
    {
     "reg": "공무국외출장 관리규칙",
     "label": "별지 제2호 서식",
     "title": "국외출장 실시계획서"
    },
    {
     "reg": "공무국외출장 관리규칙",
     "label": "별지 제5호 서식",
     "title": "국외출장 귀국보고서"
    },
    {
     "reg": "공무국외출장 관리규칙",
     "label": "별지 제6호 서식",
     "title": "국외출장 서약서"
    }
   ],
   "tips": [
    "출장 목적·출장국이 기본계획과 달라지면 위원회 재심사 대상이 될 수 있습니다(「공무국외출장 관리규칙」 제9조제2항).",
    "국외 숙박비·식비를 상한보다 더 쓴 경우 추가 지급 신청은 귀국 다음 날부터 14일 이내입니다(「여비규정」 제15조제2항)."
   ],
   "pitfalls": [
    {
     "t": "국외출장 실시계획서·서약서를 출국일 10일 전까지 냈나요?",
     "check": {"kind": "lead", "ref": "start", "days": 10},
     "basis": [
      {
       "reg": "공무국외출장 관리규칙",
       "art": "9"
      }
     ]
    },
    {
     "t": "출장 목적·출장국이 기본계획서와 달라지지 않았나요? 달라지면 재심사 대상이 될 수 있습니다.",
     "basis": [
      {
       "reg": "공무국외출장 관리규칙",
       "art": "9"
      }
     ]
    },
    {
     "t": "귀국보고서에 현지 일정 진행을 증명하는 검증자료를 붙였나요?",
     "basis": [
      {
       "reg": "공무국외출장 관리규칙",
       "art": "13"
      }
     ]
    },
    {
     "t": "귀국 후 10일 안에 항공마일리지 신고서를 냈나요?",
     "basis": [
      {
       "reg": "공무국외출장 관리규칙",
       "art": "13"
      }
     ]
    },
    {
     "t": "운임·숙박비 정산을 귀국 다음 날부터 14일 안에 신청했나요?",
     "basis": [
      {
       "reg": "여비규정",
       "art": "8"
      }
     ]
    }
   ],
   "verified": {
    "공무국외출장 관리규칙": "2023년도 9월 일부개정",
    "복무규정": "2025년도 10월 일부개정",
    "여비규정": "2023년도 5월 일부개정"
   }
  },
  {
   "id": "leave",
   "icon": "🌴",
   "category": "복무",
   "title": "휴가 — 연차·병가·공가·특별휴가",
   "summary": "휴가 종류를 확인하고 근무상황을 등록·결재합니다. 병가·특별휴가는 증빙 제출 기준이 있습니다.",
   "triggers": [
    "휴가",
    "연차",
    "반차",
    "반일",
    "병가",
    "공가",
    "특별휴가",
    "경조사",
    "경조휴가",
    "결혼",
    "출산",